{
  "schema": "fq-cartridge/2",
  "description": "GLM-5.2 cost-optimized MSRT graph: the same K2 and K3 bases and the same 2-5 bpw product range as glm52-k2k3-dag.json, minus the two narrow-step stages (k2r1r1, k3r1r1). Seven quantization passes per weight matrix instead of nine: 7.946 s/matrix of measured trellis kernel time instead of 11.182, and 12 nominal trellis bits per weight instead of 14. What is given up is the +1-bit upgrade path for a consumer who already installed k2+k2r1 or k3+k3r1; the same final bitrate is still reachable by fetching the wider residual, at measured 9.0% (K2 family) and 6.8% (K3 family) LOWER error. See docs/MSRT-CAMPAIGN.md for the measurement and the cost of each menu.",
  "bases": [
    {"label": "k2", "k": 2, "description": "2 bpw progressive fast-load base"},
    {"label": "k3", "k": 3, "description": "3 bpw base, comparable to the published K3 quants"}
  ],
  "stages": [
    {"label": "k2r1", "k": 1, "parent": "k2", "experts": "all",
     "description": "K2+1 -> 3 bpw, K3-like; also the +1-bit upgrade from the k2 base"},
    {"label": "k2r2", "k": 2, "parent": "k2", "experts": "all",
     "description": "K2+2 -> 4 bpw, K4-like in one fetch"},
    {"label": "k2r2r1", "k": 1, "parent": "k2r2", "experts": "all",
     "description": "K2+2+1 -> 5 bpw, K5-like; the +1-bit upgrade from k2-k4like-direct"},
    {"label": "k3r1", "k": 1, "parent": "k3", "experts": "all",
     "description": "K3+1 -> 4 bpw, K4-like; also the +1-bit upgrade from the k3 base"},
    {"label": "k3r2", "k": 2, "parent": "k3", "experts": "all",
     "description": "K3+2 -> 5 bpw, K5-like in one fetch"}
  ],
  "assemblies": [
    {"label": "k2", "base": "k2", "chain": []},
    {"label": "k2-k3like", "base": "k2", "chain": ["k2r1"]},
    {"label": "k2-k4like-direct", "base": "k2", "chain": ["k2r2"]},
    {"label": "k2-k5like", "base": "k2", "chain": ["k2r2", "k2r2r1"]},
    {"label": "k3", "base": "k3", "chain": []},
    {"label": "k3-k4like", "base": "k3", "chain": ["k3r1"]},
    {"label": "k3-k5like-direct", "base": "k3", "chain": ["k3r2"]}
  ],
  "moe_layers": [
    3, 4, 5, 6, 7, 8, 9, 10, 11, 12, 13, 14, 15, 16, 17, 18, 19, 20,
    21, 22, 23, 24, 25, 26, 27, 28, 29, 30, 31, 32, 33, 34, 35, 36, 37,
    38, 39, 40, 41, 42, 43, 44, 45, 46, 47, 48, 49, 50, 51, 52, 53, 54,
    55, 56, 57, 58, 59, 60, 61, 62, 63, 64, 65, 66, 67, 68, 69, 70, 71,
    72, 73, 74, 75, 76, 77, 78
  ]
}
