{
  "schema": "fq-cartridge/2",
  "description": "Fruit SIQ proxy, cost-optimized: the same shape as glm52-k2k3-lean.json (two bases, five stages, seven products) so the rehearsal exercises the graph the campaign will actually run.",
  "bases": [
    {
      "label": "k2",
      "k": 2,
      "description": "2 bpw progressive fast-load base"
    },
    {
      "label": "k3",
      "k": 3,
      "description": "3 bpw base"
    }
  ],
  "stages": [
    {
      "label": "k2r1",
      "k": 1,
      "parent": "k2",
      "experts": "all",
      "description": "K2+1 -> 3 bpw, K3-like"
    },
    {
      "label": "k2r2",
      "k": 2,
      "parent": "k2",
      "experts": "all",
      "description": "K2+2 -> 4 bpw, K4-like"
    },
    {
      "label": "k2r2r1",
      "k": 1,
      "parent": "k2r2",
      "experts": "all",
      "description": "K2+2+1 -> 5 bpw, K5-like"
    },
    {
      "label": "k3r1",
      "k": 1,
      "parent": "k3",
      "experts": "all",
      "description": "K3+1 -> 4 bpw, K4-like"
    },
    {
      "label": "k3r2",
      "k": 2,
      "parent": "k3",
      "experts": "all",
      "description": "K3+2 -> 5 bpw, K5-like"
    }
  ],
  "assemblies": [
    {
      "label": "k2",
      "base": "k2",
      "chain": []
    },
    {
      "label": "k2-k3like",
      "base": "k2",
      "chain": [
        "k2r1"
      ]
    },
    {
      "label": "k2-k4like-direct",
      "base": "k2",
      "chain": [
        "k2r2"
      ]
    },
    {
      "label": "k2-k5like",
      "base": "k2",
      "chain": [
        "k2r2",
        "k2r2r1"
      ]
    },
    {
      "label": "k3",
      "base": "k3",
      "chain": []
    },
    {
      "label": "k3-k4like",
      "base": "k3",
      "chain": [
        "k3r1"
      ]
    },
    {
      "label": "k3-k5like-direct",
      "base": "k3",
      "chain": [
        "k3r2"
      ]
    }
  ],
  "moe_layers": [
    3,
    4,
    5,
    6,
    7,
    8,
    9,
    10,
    11,
    12,
    13
  ]
}
