{
  "schema": "fq-cartridge/2",
  "description": "GLM-5.2 progressive MSRT graph: K2 and K3 bases plus every requested additive increment (K2+1, K2+2, K2+1+1, K2+2+1, K3+1, K3+1+1, K3+2) on all 256 routed experts of every MoE layer, including the MTP layer 78. Nine quantization passes per weight matrix produce nine loadable products between 2 and 5 bits per weight.",
  "bases": [
    {"label": "k2", "k": 2, "description": "2 bpw progressive fast-load base"},
    {"label": "k3", "k": 3, "description": "3 bpw base, comparable to the published K3 quants"}
  ],
  "stages": [
    {"label": "k2r1", "k": 1, "parent": "k2", "experts": "all",
     "description": "K2+1 -> 3 bpw, K3-like"},
    {"label": "k2r1r1", "k": 1, "parent": "k2r1", "experts": "all",
     "description": "K2+1+1 -> 4 bpw, K4-like, upgrades an installed K2+1"},
    {"label": "k2r2", "k": 2, "parent": "k2", "experts": "all",
     "description": "K2+2 -> 4 bpw, K4-like in one fetch"},
    {"label": "k2r2r1", "k": 1, "parent": "k2r2", "experts": "all",
     "description": "K2+2+1 -> 5 bpw, K5-like"},
    {"label": "k3r1", "k": 1, "parent": "k3", "experts": "all",
     "description": "K3+1 -> 4 bpw, K4-like"},
    {"label": "k3r1r1", "k": 1, "parent": "k3r1", "experts": "all",
     "description": "K3+1+1 -> 5 bpw, K5-like, upgrades an installed K3+1"},
    {"label": "k3r2", "k": 2, "parent": "k3", "experts": "all",
     "description": "K3+2 -> 5 bpw, K5-like in one fetch"}
  ],
  "assemblies": [
    {"label": "k2", "base": "k2", "chain": []},
    {"label": "k2-k3like", "base": "k2", "chain": ["k2r1"]},
    {"label": "k2-k4like-stepped", "base": "k2", "chain": ["k2r1", "k2r1r1"]},
    {"label": "k2-k4like-direct", "base": "k2", "chain": ["k2r2"]},
    {"label": "k2-k5like", "base": "k2", "chain": ["k2r2", "k2r2r1"]},
    {"label": "k3", "base": "k3", "chain": []},
    {"label": "k3-k4like", "base": "k3", "chain": ["k3r1"]},
    {"label": "k3-k5like-stepped", "base": "k3", "chain": ["k3r1", "k3r1r1"]},
    {"label": "k3-k5like-direct", "base": "k3", "chain": ["k3r2"]}
  ],
  "moe_layers": [
    3, 4, 5, 6, 7, 8, 9, 10, 11, 12, 13, 14, 15, 16, 17, 18, 19, 20,
    21, 22, 23, 24, 25, 26, 27, 28, 29, 30, 31, 32, 33, 34, 35, 36, 37,
    38, 39, 40, 41, 42, 43, 44, 45, 46, 47, 48, 49, 50, 51, 52, 53, 54,
    55, 56, 57, 58, 59, 60, 61, 62, 63, 64, 65, 66, 67, 68, 69, 70, 71,
    72, 73, 74, 75, 76, 77, 78
  ]
}
